{
  "version": "1.0.0",
  "sourceVersion": "独自確認視点 v1（公式44項目との対応は未検証）",
  "sourceTitle": "適ケアくん・公開ナレッジ",
  "generatedAt": "2026-09-17",
  "kind": "original",
  "sources": [
    {
      "id": "original-v1",
      "title": "独自作成の確認視点。公式資料本文の転載ではありません。",
      "url": "https://www.jri.co.jp/service/special/content11/corner113/caremanagement/"
    }
  ],
  "items": [
    {
      "id": "V01",
      "name": "本人が望む暮らし",
      "concepts": ["intention"],
      "terms": ["希望", "したい", "続けたい", "意向"],
      "assessment23": [7],
      "target": "本人",
      "question": "今の暮らしで続けたいことと、変えたいことは何ですか",
      "purpose": "本人の言葉を支援方針の出発点にする",
      "sourceRefs": ["original-v1"]
    },
    {
      "id": "V02",
      "name": "意思を伝えやすい方法",
      "concepts": ["communication"],
      "terms": ["会話", "意思疎通", "言葉", "伝え"],
      "assessment23": [14],
      "target": "本人",
      "question": "伝えやすい方法や、話しやすい時間・場所はありますか",
      "purpose": "本人が意思を表しやすい条件を整理する",
      "sourceRefs": ["original-v1"]
    },
    {
      "id": "V03",
      "name": "判断を支える情報",
      "concepts": ["decision"],
      "terms": ["判断", "認知", "説明", "迷い"],
      "assessment23": [13, 7],
      "target": "本人",
      "question": "選択肢の説明で分かりにくかった点はありますか",
      "purpose": "理解と選択を支える方法を検討する",
      "sourceRefs": ["original-v1"]
    },
    {
      "id": "V04",
      "name": "本人と家族の意向の違い",
      "concepts": ["intention"],
      "terms": ["希望", "意向", "反対", "施設"],
      "assessment23": [7, 21],
      "target": "本人・家族（関与がある場合）",
      "question": "本人と家族、それぞれが大切にしていることは何ですか",
      "purpose": "意向を混同せず共通点と違いを整理する",
      "sourceRefs": ["original-v1"]
    },
    {
      "id": "V05",
      "name": "生活歴と大切な習慣",
      "concepts": ["history"],
      "terms": ["以前", "生活歴", "仕事", "習慣"],
      "assessment23": [2],
      "target": "本人",
      "question": "以前から大切にしてきた役割や習慣はありますか",
      "purpose": "支援の中でも保ちたい生活を具体化する",
      "sourceRefs": ["original-v1"]
    },
    {
      "id": "V06",
      "name": "できていること・強み",
      "concepts": ["strength"],
      "terms": ["自分で", "できる", "継続", "楽しみ"],
      "assessment23": [11, 12, 20],
      "target": "本人",
      "question": "今も自分でできていることと、その工夫を教えてください",
      "purpose": "本人の力を生かせる支援を整理する",
      "sourceRefs": ["original-v1"]
    },
    {
      "id": "V07",
      "name": "暮らしの変化",
      "concepts": ["change"],
      "terms": ["最近", "増え", "低下", "減っ", "退院"],
      "assessment23": [9, 2],
      "target": "本人",
      "question": "以前と比べ、いつから何が変わりましたか",
      "purpose": "変化の時期と生活への影響を把握する",
      "sourceRefs": ["original-v1"]
    },
    {
      "id": "V08",
      "name": "相談・連絡の方法",
      "concepts": ["coordination"],
      "terms": ["連絡", "相談", "支援者"],
      "assessment23": [4, 14],
      "target": "本人",
      "question": "困ったときに相談できる相手と連絡方法はありますか",
      "purpose": "相談が途切れない方法を考える",
      "sourceRefs": ["original-v1"]
    },
    {
      "id": "V09",
      "name": "治療方針の理解",
      "concepts": ["health"],
      "terms": ["疾患", "心不全", "糖尿病", "病", "治療"],
      "assessment23": [10],
      "target": "本人・主治医",
      "question": "治療上の注意点について、どのような説明を受けていますか",
      "purpose": "医療側の方針と暮らしの工夫をつなぐ",
      "sourceRefs": ["original-v1"]
    },
    {
      "id": "V10",
      "name": "体調変化の把握",
      "concepts": ["health"],
      "terms": ["息切れ", "むくみ", "痛み", "発熱", "体調"],
      "assessment23": [10],
      "target": "本人・看護師",
      "question": "いつから、どの場面で、どのような体調変化がありますか",
      "purpose": "経過を共有して確認すべき事項を整理する",
      "sourceRefs": ["original-v1"]
    },
    {
      "id": "V11",
      "name": "受診を続ける方法",
      "concepts": ["health"],
      "terms": ["受診", "通院", "病院"],
      "assessment23": [10],
      "target": "本人",
      "question": "通院手段や予約・受診時の困りごとはありますか",
      "purpose": "受診を続けるための条件を整理する",
      "sourceRefs": ["original-v1"]
    },
    {
      "id": "V12",
      "name": "服薬の実際",
      "concepts": ["medication"],
      "terms": ["薬", "服薬", "残薬", "飲み忘れ"],
      "assessment23": [10, 12],
      "target": "本人・薬剤師",
      "question": "直近の服薬状況、飲み忘れや残薬をどのように確認していますか",
      "purpose": "管理方法と実際の服用を分けて把握する",
      "sourceRefs": ["original-v1"]
    },
    {
      "id": "V13",
      "name": "薬の変更と生活への影響",
      "concepts": ["medication"],
      "terms": ["薬", "処方", "眠気", "めまい"],
      "assessment23": [10],
      "target": "本人・薬剤師",
      "question": "薬が変わった時期と、暮らしの変化に重なりはありますか",
      "purpose": "薬との関係は断定せず専門職に確認する",
      "sourceRefs": ["original-v1"]
    },
    {
      "id": "V14",
      "name": "転倒の状況と背景",
      "concepts": ["falls"],
      "terms": ["転倒", "転ん", "つまず", "ふらつ"],
      "assessment23": [11, 22],
      "target": "本人・関係サービス",
      "question": "いつ、どこで、何をしているときに転びましたか。痛みなどはありますか",
      "purpose": "動作・環境・体調のどこを詳しく確認するか整理する",
      "sourceRefs": ["original-v1"]
    },
    {
      "id": "V15",
      "name": "移動方法と使いやすさ",
      "concepts": ["mobility"],
      "terms": ["歩行", "歩く", "歩き", "杖", "車椅子", "移動", "歩い"],
      "assessment23": [11],
      "target": "本人・リハ職",
      "question": "屋内外の移動で難しい場面と、使っている補助具は何ですか",
      "purpose": "本人の移動方法に合った支援を検討する",
      "sourceRefs": ["original-v1"]
    },
    {
      "id": "V16",
      "name": "立ち上がり・移乗",
      "concepts": ["mobility"],
      "terms": ["立位", "立ち上が", "移乗", "ベッド"],
      "assessment23": [11],
      "target": "本人・リハ職",
      "question": "立ち上がりや移乗のどの動作に難しさがありますか",
      "purpose": "場面ごとの動作と介助方法を整理する",
      "sourceRefs": ["original-v1"]
    },
    {
      "id": "V17",
      "name": "活動と休息の配分",
      "concepts": ["activity"],
      "terms": ["疲れ", "活動", "休息", "息切れ"],
      "assessment23": [15, 11],
      "target": "本人",
      "question": "活動後の疲れや休息の取り方はどう変わりましたか",
      "purpose": "無理のない生活の組み立てを考える",
      "sourceRefs": ["original-v1"]
    },
    {
      "id": "V18",
      "name": "住まいの動線",
      "concepts": ["housing"],
      "terms": ["段差", "手すり", "階段", "住宅", "住まい"],
      "assessment23": [22],
      "target": "本人・リハ職",
      "question": "よく通る場所で使いづらいところはありますか",
      "purpose": "生活動作に合わせて住環境を点検する",
      "sourceRefs": ["original-v1"]
    },
    {
      "id": "V19",
      "name": "夜間の移動",
      "concepts": ["falls"],
      "terms": ["夜間", "トイレ", "暗い"],
      "assessment23": [15, 16, 22],
      "target": "本人",
      "question": "夜間に移動する経路、明かり、足元の状況はどうですか",
      "purpose": "夜間の生活場面に絞って条件を確認する",
      "sourceRefs": ["original-v1"]
    },
    {
      "id": "V20",
      "name": "食事量と変化",
      "concepts": ["nutrition"],
      "terms": ["食事", "食欲", "食べ", "体重"],
      "assessment23": [19, 10],
      "target": "本人・管理栄養士",
      "question": "食事量や体重は、いつからどの程度変化しましたか",
      "purpose": "食事を続けにくい背景を把握する",
      "sourceRefs": ["original-v1"]
    },
    {
      "id": "V21",
      "name": "水分の取り方",
      "concepts": ["hydration"],
      "terms": ["水分", "飲水", "脱水"],
      "assessment23": [19],
      "target": "本人・看護師",
      "question": "普段の水分の取り方と医療職からの指示を教えてください",
      "purpose": "個別の指示を踏まえて水分摂取の実際を確認する",
      "sourceRefs": ["original-v1"]
    },
    {
      "id": "V22",
      "name": "食べる動作・むせ",
      "concepts": ["swallowing"],
      "terms": ["むせ", "嚥下", "飲み込み"],
      "assessment23": [19, 11],
      "target": "本人・看護師・リハ職",
      "question": "どんな食べ物や飲み物で、どの場面にむせが起こりますか",
      "purpose": "食べる場面を共有して専門職と確認する",
      "sourceRefs": ["original-v1"]
    },
    {
      "id": "V23",
      "name": "口の中と義歯",
      "concepts": ["oral"],
      "terms": ["口腔", "義歯", "歯", "口の中"],
      "assessment23": [18],
      "target": "本人・歯科職",
      "question": "口の痛みや義歯の使いづらさ、手入れの状況はいかがですか",
      "purpose": "食事や会話を支える口腔の状態を把握する",
      "sourceRefs": ["original-v1"]
    },
    {
      "id": "V24",
      "name": "調理・買物の継続",
      "concepts": ["iadl"],
      "terms": ["調理", "買物", "買い物", "料理"],
      "assessment23": [12, 19],
      "target": "本人",
      "question": "食材の準備や調理で続けられていること、難しいことは何ですか",
      "purpose": "食事の準備を含めた生活機能を把握する",
      "sourceRefs": ["original-v1"]
    },
    {
      "id": "V25",
      "name": "排泄のリズム",
      "concepts": ["elimination"],
      "terms": ["排泄", "尿", "便秘", "失禁", "トイレ"],
      "assessment23": [16],
      "target": "本人・看護師",
      "question": "排泄の時間・回数・困る場面はどう変化していますか",
      "purpose": "本人の負担と生活リズムへの影響を整理する",
      "sourceRefs": ["original-v1"]
    },
    {
      "id": "V26",
      "name": "排泄動作と環境",
      "concepts": ["elimination"],
      "terms": ["トイレ", "排泄", "後始末"],
      "assessment23": [16, 11],
      "target": "本人",
      "question": "トイレの移動から後始末まで、どこに難しさがありますか",
      "purpose": "動作と環境を分けて確認する",
      "sourceRefs": ["original-v1"]
    },
    {
      "id": "V27",
      "name": "入浴・身だしなみ",
      "concepts": ["hygiene"],
      "terms": ["入浴", "洗身", "整容", "清潔"],
      "assessment23": [17, 11],
      "target": "本人",
      "question": "入浴や身だしなみについて、希望と困りごとはありますか",
      "purpose": "本人の習慣に合う清潔保持を考える",
      "sourceRefs": ["original-v1"]
    },
    {
      "id": "V28",
      "name": "皮膚と身体の手入れ",
      "concepts": ["skin"],
      "terms": ["皮膚", "褥瘡", "傷", "かゆ"],
      "assessment23": [10, 17],
      "target": "本人・看護師",
      "question": "皮膚の変化や手入れで気になることはありますか",
      "purpose": "身体の変化を関係職種と共有する",
      "sourceRefs": ["original-v1"]
    },
    {
      "id": "V29",
      "name": "睡眠と生活リズム",
      "concepts": ["sleep"],
      "terms": ["睡眠", "寝不足", "夜間", "昼夜", "就寝", "眠れ"],
      "assessment23": [15],
      "target": "本人",
      "question": "眠りを妨げることや、日中の眠気はありますか",
      "purpose": "生活全体のリズムと休息を把握する",
      "sourceRefs": ["original-v1"]
    },
    {
      "id": "V30",
      "name": "記憶・判断と生活",
      "concepts": ["cognition"],
      "terms": ["認知", "物忘れ", "忘れ", "判断"],
      "assessment23": [13],
      "target": "本人・家族（関与がある場合）",
      "question": "覚えにくさや判断の難しさは、どの生活場面で現れていますか",
      "purpose": "診断名だけでなく具体的な暮らしへの影響を確認する",
      "sourceRefs": ["original-v1"]
    },
    {
      "id": "V31",
      "name": "不安と気持ち",
      "concepts": ["emotion"],
      "terms": ["不安", "心配", "落ち込", "拒否"],
      "assessment23": [7, 13],
      "target": "本人",
      "question": "何が気がかりで、どんなときに安心できますか",
      "purpose": "本人の体験と受け止めを理解する",
      "sourceRefs": ["original-v1"]
    },
    {
      "id": "V32",
      "name": "見え方・聞こえ方",